<!ELEMENT students (student+)>
<!ELEMENT student (name, rollno, course, email)>
<!ELEMENT name (#PCDATA)>
<!ELEMENT rollno (#PCDATA)>
<!ELEMENT course (#PCDATA)>
<!ELEMENT email (#PCDATA)>
